Headphone Name,Subreddit,Post_Title,Post_ID,Post_Author,Post_URL,Post_Score,Num_Comments,Created,Comment,Comment_Author,Comment_Score
oneplus buds pro 2,oneplus,Oneplus Buds Pro 2- long term review (AMA),13pued7,Corbin_Dallas550,https://www.reddit.com/r/oneplus/comments/13pued7/oneplus_buds_pro_2_long_term_review_ama/,17,53,1685034498.0,"I'm not sure about the pause delay, I'm using a Galaxy 22 ultra and it seems to be fairly fast for me.  For volume control I use my watch, so it's not been an issue for me.

To stay in your ear, the foam tips are the way to go as I jog daily and do situps and lineman drills (solo) and they  stay in place",Corbin_Dallas550,2.0
oneplus buds pro 2,oneplus,Oneplus Buds Pro 2- long term review (AMA),13pued7,Corbin_Dallas550,https://www.reddit.com/r/oneplus/comments/13pued7/oneplus_buds_pro_2_long_term_review_ama/,17,53,1686909075.0,"I have a question about multipoint. When you are connected to 2 devices and first is playing, then you start play music on the second device - does it stop music on first and switch automatically?",Bogdan2590,1.0
oneplus buds pro 2,oneplus,Oneplus Buds Pro 2- long term review (AMA),13pued7,Corbin_Dallas550,https://www.reddit.com/r/oneplus/comments/13pued7/oneplus_buds_pro_2_long_term_review_ama/,17,53,1684931001.0,"It's a pity that they didn't release a white version of the Buds Pro 2, at least not in Europe. Otherwise I would get one ðŸ˜•",5Lucas,1.0
oneplus buds pro 2,oneplus,Oneplus Buds Pro 2- long term review (AMA),13pued7,Corbin_Dallas550,https://www.reddit.com/r/oneplus/comments/13pued7/oneplus_buds_pro_2_long_term_review_ama/,17,53,1685030290.0,"Quick question, I just ordered a pair. For the squeeze to play/pause time, is it nearly instantenous or is there a slight delay.?

For example, my previous set was the galaxy buds pro (1st gen) with an S10+, and when I tapped the bud to pause, it took about 0.1-0.2s. When I used my galaxy buds on my Oneplus 11, I measured a 1.2-1.7s delay before it paused the music. This and the lower music quality (since OP does not have samsungs scalable codec), made me want to upgrade. 

&#x200B;

The lack of volume control is annoying (hopefully you can recommend some solution, beyond manually pressing the buttons on the phone), and I hope these headphones can stay in my ear when I go for light runs and do stair runs like my galaxy buds pros.

&#x200B;

If the LHDC or LC3 Codec support on the oneplus buds pro 2 sound better than the AAC on my galaxy buds, with better latency and squeeze responsiveness, I will be tempted to keep them.",AshM1999,1.0
oneplus buds pro 2,oneplus,Oneplus Buds Pro 2- long term review (AMA),13pued7,Corbin_Dallas550,https://www.reddit.com/r/oneplus/comments/13pued7/oneplus_buds_pro_2_long_term_review_ama/,17,53,1685202682.0,"Hey, how do i get spatial audio even though I dont have OnePlus phone. I own Xiaomi mi A2..",Jabberwocky696,1.0
oneplus buds pro 2,oneplus,Oneplus Buds Pro 2- long term review (AMA),13pued7,Corbin_Dallas550,https://www.reddit.com/r/oneplus/comments/13pued7/oneplus_buds_pro_2_long_term_review_ama/,17,53,1685653377.0,did they solve the oneplus buds pro 1 battery/connectivity issue?,Pure_Ad_7638,1.0
oneplus buds pro 2,oneplus,Oneplus Buds Pro 2- long term review (AMA),13pued7,Corbin_Dallas550,https://www.reddit.com/r/oneplus/comments/13pued7/oneplus_buds_pro_2_long_term_review_ama/,17,53,1686017574.0,[deleted],None,1.0
oneplus buds pro 2,oneplus,Oneplus Buds Pro 2- long term review (AMA),13pued7,Corbin_Dallas550,https://www.reddit.com/r/oneplus/comments/13pued7/oneplus_buds_pro_2_long_term_review_ama/,17,53,1687385775.0,Where did you get the foam tips? I've been looking for some,Gustavo99Shirou,1.0
oneplus buds pro 2,oneplus,Oneplus Buds Pro 2- long term review (AMA),13pued7,Corbin_Dallas550,https://www.reddit.com/r/oneplus/comments/13pued7/oneplus_buds_pro_2_long_term_review_ama/,17,53,1688333737.0,How the connection between rooms moving??,Key_Shine5175,1.0
oneplus buds pro 2,oneplus,Oneplus Buds Pro 2- long term review (AMA),13pued7,Corbin_Dallas550,https://www.reddit.com/r/oneplus/comments/13pued7/oneplus_buds_pro_2_long_term_review_ama/,17,53,1688333749.0,How the connection between rooms moving?,Key_Shine5175,1.0
oneplus buds pro 2,oneplus,Oneplus Buds Pro 2- long term review (AMA),13pued7,Corbin_Dallas550,https://www.reddit.com/r/oneplus/comments/13pued7/oneplus_buds_pro_2_long_term_review_ama/,17,53,1688652062.0,[removed],None,1.0
oneplus buds pro 2,oneplus,Oneplus Buds Pro 2- long term review (AMA),13pued7,Corbin_Dallas550,https://www.reddit.com/r/oneplus/comments/13pued7/oneplus_buds_pro_2_long_term_review_ama/,17,53,1688867732.0,have you used head tracking? and if so is it any good?,Hoauk,1.0
oneplus buds pro 2,oneplus,Oneplus Buds Pro 2- long term review (AMA),13pued7,Corbin_Dallas550,https://www.reddit.com/r/oneplus/comments/13pued7/oneplus_buds_pro_2_long_term_review_ama/,17,53,1693698322.0,I'm deciding between OnePlus buds pro 2 and soundcore Liberty 4. Any advice?,helloworld2144,1.0
oneplus buds pro 2,oneplus,Oneplus Buds Pro 2- long term review (AMA),13pued7,Corbin_Dallas550,https://www.reddit.com/r/oneplus/comments/13pued7/oneplus_buds_pro_2_long_term_review_ama/,17,53,1693725787.0,"I read that there was a software update for the headphones, and it affected their sound quality.
Have they fixed it and can I update my headphones safely?  Or it is better to avoid updating?",Suitable-Ad8131,1.0
oneplus buds pro 2,oneplus,Oneplus Buds Pro 2- long term review (AMA),13pued7,Corbin_Dallas550,https://www.reddit.com/r/oneplus/comments/13pued7/oneplus_buds_pro_2_long_term_review_ama/,17,53,1694083885.0,"I have a question. Is mono mode not a thing on these earbuds or is mine just not working properly, because i often use only one earbud and it seems not to work properly.",UnleashedSavage,1.0
oneplus buds pro 2,oneplus,Oneplus Buds Pro 2- long term review (AMA),13pued7,Corbin_Dallas550,https://www.reddit.com/r/oneplus/comments/13pued7/oneplus_buds_pro_2_long_term_review_ama/,17,53,1696021019.0,mine have to be replaced twice in 4 months. Very horrible product at first right earbud died and after replacement left one died after 2 months. Please OnePlus either make a premium product or dont but don't make premium products which are premium looking on the outside only.,DogAdministrative791,1.0
oneplus buds pro 2,oneplus,Oneplus Buds Pro 2- long term review (AMA),13pued7,Corbin_Dallas550,https://www.reddit.com/r/oneplus/comments/13pued7/oneplus_buds_pro_2_long_term_review_ama/,17,53,1696981653.0,How is your battery life now. As so many users complain that battery doesn't last even for hour after 6 months of usage.,None,1.0
oneplus buds pro 2,oneplus,Oneplus Buds Pro 2- long term review (AMA),13pued7,Corbin_Dallas550,https://www.reddit.com/r/oneplus/comments/13pued7/oneplus_buds_pro_2_long_term_review_ama/,17,53,1697598245.0,Is it normal to not be heard on calls using one earbud?,KyleGrizz,1.0
oneplus buds pro 2,oneplus,Oneplus Buds Pro 2- long term review (AMA),13pued7,Corbin_Dallas550,https://www.reddit.com/r/oneplus/comments/13pued7/oneplus_buds_pro_2_long_term_review_ama/,17,53,1698080992.0,"Planning on Getting a pair, anyone can confirm that the Spatial Audio workings on non OPO devices ? Planning on getting a P8Pro",BasuruK69,1.0
oneplus buds pro 2,oneplus,Oneplus Buds Pro 2- long term review (AMA),13pued7,Corbin_Dallas550,https://www.reddit.com/r/oneplus/comments/13pued7/oneplus_buds_pro_2_long_term_review_ama/,17,53,1698875937.0,"Using 13 pro max, do you think buds 2 pro better than airpods 2 pro",None,1.0
oneplus buds pro 2,oneplus,Oneplus Buds Pro 2- long term review (AMA),13pued7,Corbin_Dallas550,https://www.reddit.com/r/oneplus/comments/13pued7/oneplus_buds_pro_2_long_term_review_ama/,17,53,1699349818.0,"Just got em, loving the sound quality, but not so much the build quality.

The case feels a bit cheap and fragile. Is that cover case just one of those silicone chinese ones? Hope to find something better ):",NullFortax,1.0
oneplus buds pro 2,oneplus,Oneplus Buds Pro 2- long term review (AMA),13pued7,Corbin_Dallas550,https://www.reddit.com/r/oneplus/comments/13pued7/oneplus_buds_pro_2_long_term_review_ama/,17,53,1686914076.0,"Yes, it actually works very well.  There is a hidden button that you have to go in and turn on to make it work, but once you set it up it works great",Corbin_Dallas550,1.0
oneplus buds pro 2,oneplus,Oneplus Buds Pro 2- long term review (AMA),13pued7,Corbin_Dallas550,https://www.reddit.com/r/oneplus/comments/13pued7/oneplus_buds_pro_2_long_term_review_ama/,17,53,1684935723.0,"Not in the us either, there is no white version on their website.  The green is sexy tho, it has metallic reflective paint mixed in that looks great",Corbin_Dallas550,1.0
oneplus buds pro 2,oneplus,Oneplus Buds Pro 2- long term review (AMA),13pued7,Corbin_Dallas550,https://www.reddit.com/r/oneplus/comments/13pued7/oneplus_buds_pro_2_long_term_review_ama/,17,53,1685040418.0,">I'm not sure about the pause delay, I'm using a Galaxy 22 ultra and it seems to be fairly fast for me.  For volume control I use my watch, so it's not been an issue for me.  
>  
>To stay in your ear, the foam tips are the way to go as I jog daily and do situps and lineman drills (solo) and they  stay in place",Corbin_Dallas550,2.0
oneplus buds pro 2,oneplus,Oneplus Buds Pro 2- long term review (AMA),13pued7,Corbin_Dallas550,https://www.reddit.com/r/oneplus/comments/13pued7/oneplus_buds_pro_2_long_term_review_ama/,17,53,1690719268.0,I use the assistant for volume control,D4ddyC0ol,1.0
oneplus buds pro 2,oneplus,Oneplus Buds Pro 2- long term review (AMA),13pued7,Corbin_Dallas550,https://www.reddit.com/r/oneplus/comments/13pued7/oneplus_buds_pro_2_long_term_review_ama/,17,53,1685203050.0,"Special audio only works on the OnePlus 11, but I can see the update coming for this probably in the next 4 to 6 months to go to every phone.",Corbin_Dallas550,1.0
oneplus buds pro 2,oneplus,Oneplus Buds Pro 2- long term review (AMA),13pued7,Corbin_Dallas550,https://www.reddit.com/r/oneplus/comments/13pued7/oneplus_buds_pro_2_long_term_review_ama/,17,53,1685656438.0,Not sure what you're referring to,Corbin_Dallas550,1.0
oneplus buds pro 2,oneplus,Oneplus Buds Pro 2- long term review (AMA),13pued7,Corbin_Dallas550,https://www.reddit.com/r/oneplus/comments/13pued7/oneplus_buds_pro_2_long_term_review_ama/,17,53,1686017813.0,"I have seen several videos, some good and some bad.  For me, these are great hearing pple talk  and for me talking as people say they didn't know I was on a headset.  I use them daily for at least 5 hours for talking and music.


As I said before, first pair that I had were big lemons and the mic was trash and heating people was not good, but the second pair have been great",Corbin_Dallas550,1.0
oneplus buds pro 2,oneplus,Oneplus Buds Pro 2- long term review (AMA),13pued7,Corbin_Dallas550,https://www.reddit.com/r/oneplus/comments/13pued7/oneplus_buds_pro_2_long_term_review_ama/,17,53,1687385958.0,"You'll have to cut them about 40% off to fit in the case. That's why they look a little weird lol

LINSOUL TIN HiFi T2/T2 Pro... https://www.amazon.com/dp/B085WLKLJC?ref=ppx_pop_mob_ap_share",Corbin_Dallas550,1.0
oneplus buds pro 2,oneplus,Oneplus Buds Pro 2- long term review (AMA),13pued7,Corbin_Dallas550,https://www.reddit.com/r/oneplus/comments/13pued7/oneplus_buds_pro_2_long_term_review_ama/,17,53,1688334066.0,Its great.  I have a good sized condo (1200 sq ft) and Ill walk around the house talking on the phone with my phone in a distant room with no issues and at work ill walk up and down the hallway doing the same thing going about 40ft away with no breakup through much thicker walls (music and calls).,Corbin_Dallas550,1.0
oneplus buds pro 2,oneplus,Oneplus Buds Pro 2- long term review (AMA),13pued7,Corbin_Dallas550,https://www.reddit.com/r/oneplus/comments/13pued7/oneplus_buds_pro_2_long_term_review_ama/,17,53,1692480872.0,"The buds dont even have ldac, only lhdc for high quality audio which isnt on samsungs, only realme/xiaomi/oneplus/pcoc devices. Idk about headtracjing tho",EisregenHehi,1.0
oneplus buds pro 2,oneplus,Oneplus Buds Pro 2- long term review (AMA),13pued7,Corbin_Dallas550,https://www.reddit.com/r/oneplus/comments/13pued7/oneplus_buds_pro_2_long_term_review_ama/,17,53,1688868781.0,It's not available on non 1 plus devices,Corbin_Dallas550,1.0
oneplus buds pro 2,oneplus,Oneplus Buds Pro 2- long term review (AMA),13pued7,Corbin_Dallas550,https://www.reddit.com/r/oneplus/comments/13pued7/oneplus_buds_pro_2_long_term_review_ama/,17,53,1694088999.0,"I'm not sure what you're referring to, but I use the right ear but only all day before I go to the gym and it works perfectly for me.

As I mentioned the first pair I had were messed up and I took them back, so you may just need to swap out pairs",Corbin_Dallas550,2.0
oneplus buds pro 2,oneplus,Oneplus Buds Pro 2- long term review (AMA),13pued7,Corbin_Dallas550,https://www.reddit.com/r/oneplus/comments/13pued7/oneplus_buds_pro_2_long_term_review_ama/,17,53,1696021098.0,"After that first pair, the second pair have been working great until this recent update. Both the left and right ear cut out on their own for about 5 minutes for no reason while I'm watching a movie or YouTube, but never with music.

Not sure why, cut that's what the are doing since the last update",Corbin_Dallas550,1.0
oneplus buds pro 2,oneplus,Oneplus Buds Pro 2- long term review (AMA),13pued7,Corbin_Dallas550,https://www.reddit.com/r/oneplus/comments/13pued7/oneplus_buds_pro_2_long_term_review_ama/,17,53,1696982458.0,"I use mine everyday, and the battery still as good as new.

I go to the gym everyday for 2 hours and listen to this when I'm walking for lunch and I usually only have to charge it once a week",Corbin_Dallas550,2.0
oneplus buds pro 2,oneplus,Oneplus Buds Pro 2- long term review (AMA),13pued7,Corbin_Dallas550,https://www.reddit.com/r/oneplus/comments/13pued7/oneplus_buds_pro_2_long_term_review_ama/,17,53,1698877110.0,"I'm not sure, but I know there are videos on YouTube comparing those 2.",Corbin_Dallas550,1.0
oneplus buds pro 2,oneplus,Oneplus Buds Pro 2- long term review (AMA),13pued7,Corbin_Dallas550,https://www.reddit.com/r/oneplus/comments/13pued7/oneplus_buds_pro_2_long_term_review_ama/,17,53,1699368029.0,"It's one of those Chinese covers, not many to choose from on Amazon unfortunately",Corbin_Dallas550,1.0
oneplus buds pro 2,oneplus,Oneplus Buds Pro 2- long term review (AMA),13pued7,Corbin_Dallas550,https://www.reddit.com/r/oneplus/comments/13pued7/oneplus_buds_pro_2_long_term_review_ama/,17,53,1686914306.0,AFAIK on buds pro 1 music does not stop automatically on another device. Are you sure it does on 2nd?,Bogdan2590,1.0
oneplus buds pro 2,oneplus,Oneplus Buds Pro 2- long term review (AMA),13pued7,Corbin_Dallas550,https://www.reddit.com/r/oneplus/comments/13pued7/oneplus_buds_pro_2_long_term_review_ama/,17,53,1684966014.0,"Personally I ain't a big fan of colourful earbuds. I prefer white only, I'm probably the one of the few ones with this opinion ðŸ˜‚",5Lucas,2.0
oneplus buds pro 2,oneplus,Oneplus Buds Pro 2- long term review (AMA),13pued7,Corbin_Dallas550,https://www.reddit.com/r/oneplus/comments/13pued7/oneplus_buds_pro_2_long_term_review_ama/,17,53,1686685819.0,"Thanks for your help. I got them last Friday. The fit is not as air-tight as my galaxy buds pro, the sounds is just as good, if not better. The stems make it easy to take out. The tips don't secure them as well. The range is ok. The connection IS NOT GOOD. I use LHDC and it drops in and out. I can change the options in dev settings to get better connection, but then I can't play some of my higher kbps tracks at their best. The lack of the volume control is kinda annoying.

&#x200B;

I got about 10 days to return them. Is there a way to get consistently good audio connection, without sacrificing sound quality. If LC3 via Bluetooth LE can fix that, great, but it won't be out for a few months at least. 

&#x200B;

What can I do?",AshM1999,2.0
oneplus buds pro 2,oneplus,Oneplus Buds Pro 2- long term review (AMA),13pued7,Corbin_Dallas550,https://www.reddit.com/r/oneplus/comments/13pued7/oneplus_buds_pro_2_long_term_review_ama/,17,53,1690230649.0,"Hi !  


Any updates on that ?",Jabberwocky696,1.0
oneplus buds pro 2,oneplus,Oneplus Buds Pro 2- long term review (AMA),13pued7,Corbin_Dallas550,https://www.reddit.com/r/oneplus/comments/13pued7/oneplus_buds_pro_2_long_term_review_ama/,17,53,1696435687.0,The previous buds pro had a consistent problems among many customers such as unbearably low battery backup (personally mine stand only around 5 mins now) or one ear buds not connecting/showing up on phones.,Lenge36,1.0
oneplus buds pro 2,oneplus,Oneplus Buds Pro 2- long term review (AMA),13pued7,Corbin_Dallas550,https://www.reddit.com/r/oneplus/comments/13pued7/oneplus_buds_pro_2_long_term_review_ama/,17,53,1688334126.0,When lhdc enable?? Its so necessarary,Key_Shine5175,1.0
oneplus buds pro 2,oneplus,Oneplus Buds Pro 2- long term review (AMA),13pued7,Corbin_Dallas550,https://www.reddit.com/r/oneplus/comments/13pued7/oneplus_buds_pro_2_long_term_review_ama/,17,53,1696892484.0,"Is the issue still there? I'm going to buy a pair of buds during these 2 days of amazon prime discounts, these might be my purchase. Yet I keep finding people reporting buds and problems and that kinda scares me off",Meruem90,1.0
oneplus buds pro 2,oneplus,Oneplus Buds Pro 2- long term review (AMA),13pued7,Corbin_Dallas550,https://www.reddit.com/r/oneplus/comments/13pued7/oneplus_buds_pro_2_long_term_review_ama/,17,53,1696994211.0,Thank you for reply. I have ordered it. I will review soon. I hope it don't come defective because store is far from my location.,None,3.0
oneplus buds pro 2,oneplus,Oneplus Buds Pro 2- long term review (AMA),13pued7,Corbin_Dallas550,https://www.reddit.com/r/oneplus/comments/13pued7/oneplus_buds_pro_2_long_term_review_ama/,17,53,1690235170.0,"Thats a direct to OP question, not me lol",Corbin_Dallas550,1.0
oneplus buds pro 2,oneplus,Oneplus Buds Pro 2- long term review (AMA),13pued7,Corbin_Dallas550,https://www.reddit.com/r/oneplus/comments/13pued7/oneplus_buds_pro_2_long_term_review_ama/,17,53,1696439744.0,"There is a issue of quality control on these... Like I said the first pair I had were trash, but this second pair have been great",Corbin_Dallas550,1.0
oneplus buds pro 2,oneplus,Oneplus Buds Pro 2- long term review (AMA),13pued7,Corbin_Dallas550,https://www.reddit.com/r/oneplus/comments/13pued7/oneplus_buds_pro_2_long_term_review_ama/,17,53,1696893422.0,"I'm not sure what issue you are referring to?

Like I said the first pair I had were trash, so I sent them back and got another pair and these have been great ever since. So if you run into the same issue you might have to do the same thing",Corbin_Dallas550,1.0
oneplus buds pro 2,oneplus,Oneplus Buds Pro 2- long term review (AMA),13pued7,Corbin_Dallas550,https://www.reddit.com/r/oneplus/comments/13pued7/oneplus_buds_pro_2_long_term_review_ama/,17,53,1697037921.0,Let me know what you think.  MY first advise would be to get foam tips because the gel ones that come with it suck.  You will have to cut the foam tips to fit the case but its worth it.,Corbin_Dallas550,1.0
oneplus buds pro 2,oneplus,Oneplus Buds Pro 2- long term review (AMA),13pued7,Corbin_Dallas550,https://www.reddit.com/r/oneplus/comments/13pued7/oneplus_buds_pro_2_long_term_review_ama/,17,53,1697550022.0,"Hey, have you received your tws ? any reviews so far ?",Odd_Tadpole4694,1.0
oneplus buds pro 2,oneplus,Oneplus Buds Pro 2- long term review (AMA),13pued7,Corbin_Dallas550,https://www.reddit.com/r/oneplus/comments/13pued7/oneplus_buds_pro_2_long_term_review_ama/,17,53,1696894355.0,"I've read many people reporting stuff like:  
- defective buds dieing out of nowhere  
- battery drains (one or both buds) 
- cracking sounds/white noises on when using them 
- connection drops, laggs (frequent report)  
- charging issues (one bud not charging past a certain %)   

And often the reports seem to happen after the warranty is expired... But it's hard to understand that this is just the loud minority speaking or if it's a frequent happening.",Meruem90,1.0
oneplus buds pro 2,oneplus,Oneplus Buds Pro 2- long term review (AMA),13pued7,Corbin_Dallas550,https://www.reddit.com/r/oneplus/comments/13pued7/oneplus_buds_pro_2_long_term_review_ama/,17,53,1696894754.0,"I did have the noise issue on the original pair, like I said that original paor was totally trash

But this second pair I have has been great.. so like I said if you get a pair that's not good take them back",Corbin_Dallas550,2.0
oneplus buds pro 2,oneplus,Oneplus Buds Pro 2- long term review (AMA),13pued7,Corbin_Dallas550,https://www.reddit.com/r/oneplus/comments/13pued7/oneplus_buds_pro_2_long_term_review_ama/,17,53,1696912923.0,"Did u buy them through other sites or from oneplus directly? If the latter, do u know how are their return policies? Like, for how long the warranty covers them",Meruem90,1.0
oneplus buds pro 2,oneplus,Oneplus Buds Pro 2- long term review (AMA),13pued7,Corbin_Dallas550,https://www.reddit.com/r/oneplus/comments/13pued7/oneplus_buds_pro_2_long_term_review_ama/,19,21,1684861572.0,,,
oneplus buds pro 2,Earbuds,Oneplus buds pro 2 vs liberty 4 NC,18ahesa,Medical_Tour_9342,https://www.reddit.com/r/Earbuds/comments/18ahesa/oneplus_buds_pro_2_vs_liberty_4_nc/,2,19,1701710516.0,"So if you want bass heavy sound OnePlus pro 2 are the way to go after tuning. 

Out the box they are a nice V shape that the bass really pops with just use the Bass boost to up the bass and you might be set.",KyleGrizz,2.0
oneplus buds pro 2,Earbuds,Oneplus buds pro 2 vs liberty 4 NC,18ahesa,Medical_Tour_9342,https://www.reddit.com/r/Earbuds/comments/18ahesa/oneplus_buds_pro_2_vs_liberty_4_nc/,2,19,1701759299.0,"I have both. OP Buds Pro 2 way better sound quality prolly bc of the dual drivers. Details are far better and it is can be tuned to have more bass at the same time. 

You just canâ€™t have the same detail with the LP4NC. Harsh highs and overpowering bass. The SQ is good but Oneplus is just better. 

If you talk about ANC - Soundcore better",acoustechsoul,2.0
oneplus buds pro 2,Earbuds,Oneplus buds pro 2 vs liberty 4 NC,18ahesa,Medical_Tour_9342,https://www.reddit.com/r/Earbuds/comments/18ahesa/oneplus_buds_pro_2_vs_liberty_4_nc/,2,19,1701692909.0,Only you can tell.. Sound quality is subjective.,Curlev,1.0
oneplus buds pro 2,Earbuds,Oneplus buds pro 2 vs liberty 4 NC,18ahesa,Medical_Tour_9342,https://www.reddit.com/r/Earbuds/comments/18ahesa/oneplus_buds_pro_2_vs_liberty_4_nc/,2,19,1701742501.0,Soundcore [Liberty3 Pro](https://amzn.to/483BR1T),KevynEinstein,0.0
oneplus buds pro 2,Earbuds,Oneplus buds pro 2 vs liberty 4 NC,18ahesa,Medical_Tour_9342,https://www.reddit.com/r/Earbuds/comments/18ahesa/oneplus_buds_pro_2_vs_liberty_4_nc/,2,19,1701694999.0,"if you like bassy the l4nc's are a bad bad choice, they also do not respond well to even very powerful and experienced tuning.

if you want to tune, skip both those options and buy 30$ HTC's, after tuning they smash even 200$ headphones",None,-1.0
oneplus buds pro 2,Earbuds,Oneplus buds pro 2 vs liberty 4 NC,18ahesa,Medical_Tour_9342,https://www.reddit.com/r/Earbuds/comments/18ahesa/oneplus_buds_pro_2_vs_liberty_4_nc/,2,19,1701751071.0,Anyone else having build quality issues with their oneplus pro 2 buds? On my copy's right bud the back grille is sunken in...,Dear_Stomach_8949,1.0
oneplus buds pro 2,Earbuds,Oneplus buds pro 2 vs liberty 4 NC,18ahesa,Medical_Tour_9342,https://www.reddit.com/r/Earbuds/comments/18ahesa/oneplus_buds_pro_2_vs_liberty_4_nc/,2,19,1701805432.0,"I have OP buds pro and I love them but now there battery backup is down to 50 mins and I also don't want to buy something which becomes useless in 12 - 15 months which is the case with my OP buds.

But if OP buds pro 2 are good enough then maybe I will give them a shot again and take care of battery this time.

Anyways how your battery holding up for OP buds ?

And OP buds pro 3 are on the way, should I go ahead with v2 or wait for v3 ?",Medical_Tour_9342,1.0
oneplus buds pro 2,Earbuds,Oneplus buds pro 2 vs liberty 4 NC,18ahesa,Medical_Tour_9342,https://www.reddit.com/r/Earbuds/comments/18ahesa/oneplus_buds_pro_2_vs_liberty_4_nc/,2,19,1703851523.0,There is a big difference in terms of ANC?,unluckyy935,1.0
oneplus buds pro 2,Earbuds,Oneplus buds pro 2 vs liberty 4 NC,18ahesa,Medical_Tour_9342,https://www.reddit.com/r/Earbuds/comments/18ahesa/oneplus_buds_pro_2_vs_liberty_4_nc/,2,19,1701708709.0,The only way I can check is by buying it and I can't return stuff here once bought so only way I can check is by asking you guys,Medical_Tour_9342,1.0
oneplus buds pro 2,Earbuds,Oneplus buds pro 2 vs liberty 4 NC,18ahesa,Medical_Tour_9342,https://www.reddit.com/r/Earbuds/comments/18ahesa/oneplus_buds_pro_2_vs_liberty_4_nc/,2,19,1701708768.0,Bad in the sense like it's just only bass in the song and can't hear anything else ?,Medical_Tour_9342,2.0
oneplus buds pro 2,Earbuds,Oneplus buds pro 2 vs liberty 4 NC,18ahesa,Medical_Tour_9342,https://www.reddit.com/r/Earbuds/comments/18ahesa/oneplus_buds_pro_2_vs_liberty_4_nc/,2,19,1701714998.0,\>buy 30$ HTC's - can you tell us more what model & link? cheers!,PassOtherwise5995,1.0
oneplus buds pro 2,Earbuds,Oneplus buds pro 2 vs liberty 4 NC,18ahesa,Medical_Tour_9342,https://www.reddit.com/r/Earbuds/comments/18ahesa/oneplus_buds_pro_2_vs_liberty_4_nc/,2,19,1701805529.0,My OP buds pro battery is down to like 50 mins after 14 months but have no other issues,Medical_Tour_9342,1.0
